{
  "schemaVersion": "1",
  "repo": "wave-av/wave-monitor",
  "version": "0.2.0",
  "lifecycle": "alpha",
  "planeLayer": 0,
  "foundationPin": "v1",
  "maintainers": [
    { "team": "operator" }
  ],
  "exposes": {
    "renderSurfaces": [
      { "kind": "electron-app", "id": "online.wave.monitor" }
    ]
  },
  "consumes": {
    "waveProducts": [
      { "repo": "your-org/api-gateway", "endpoint": "/feed/{slug}" }
    ],
    "thirdParty": [
      { "service": "stun.l.google.com", "licenseGated": false }
    ],
    "foundationFrameworks": [
      "frameworks/protocol-plane",
      "frameworks/copywriting",
      "frameworks/repo-governance"
    ]
  },
  "events": {
    "publishes": [
      { "topic": "monitor.connection.failed", "transport": "sentry" }
    ]
  },
  "tags": ["operator", "public", "viewer", "on-prem", "build-on-wave"]
}
