{
  "schemaVersion": "1",
  "repo": "wave-av/wave-foundation-public",
  "version": "0.1.0",
  "lifecycle": "beta",
  "planeLayer": null,
  "foundationPin": "v1",
  "maintainers": [{ "team": "core" }],
  "consumes": {
    "waveProducts": [
      { "repo": "wave-av/wave-foundation" }
    ],
    "foundationFrameworks": ["frameworks/platform-registry"]
  },
  "tags": ["foundation", "public", "open-core", "mirror"]
}
